{
  "protocol_version": "be-lazy-prompt-autopilot-final/1.0",
  "status": "COMPLETE",
  "completed_waves": [
    "W00-BOOTSTRAP-BASELINE",
    "W01-TRUST-BOUNDARY",
    "W02-MANAGED-MUTATION",
    "W03-DIRECTOR-BLUEPRINT",
    "W04-WORKFLOW-AUTHORITY",
    "W05-AUTOMATION-QUALITY-RELEASE",
    "W06-RUNTIME-MIGRATION",
    "W07-FINAL-AUDIT"
  ],
  "completed_task_ids": [
    "BOOT-001",
    "BOOT-002",
    "BOOT-003",
    "BOOT-004",
    "BOOT-005",
    "P0-PKG-001",
    "P0-JSON-001",
    "P0-AUTH-001",
    "MUT-001",
    "MUT-002",
    "MUT-003",
    "MUT-004",
    "BP-001",
    "DIR-001",
    "DIR-002",
    "BP-002",
    "WF-001",
    "AUTH-001",
    "AUTH-002",
    "WF-002",
    "SEL-001",
    "QA-001",
    "REL-001",
    "RUN-001",
    "RUN-002",
    "MIG-001",
    "REL-002",
    "AUDIT-001",
    "AUDIT-002",
    "AUDIT-003"
  ],
  "commit_range": {
    "first": "b7aaaf2ac43ca99970c317a7d505316a07d320e9",
    "last": "2acd77c0b1b80d6449b38a0e79e859b4cfc9f4e5"
  },
  "test_summary": [
    {
      "id": "w07-full",
      "status": "passed",
      "result": "1104 passed, 4 platform-only skipped, 0 failed in 855.00s"
    },
    {
      "id": "w07-boundaries",
      "status": "passed",
      "result": "six structural gates passed with zero violations; package graph SCC 0"
    },
    {
      "id": "w07-schema-resources",
      "status": "passed",
      "result": "87 schemas, 82 versions, all packaged resource projections verified"
    },
    {
      "id": "w07-wheel",
      "status": "passed",
      "result": "two identical 257-member wheels and two isolated probes passed"
    },
    {
      "id": "w07-recovery-provenance",
      "status": "passed",
      "result": "source/handoff unchanged; W00/W01 provenance and W01-W06 recovery passed"
    }
  ],
  "source_unchanged": true,
  "handoff_verified": true,
  "remote_side_effects": false,
  "network_side_effects": false,
  "human_approval_synthesized": false,
  "public_identifier_migration_performed": false,
  "critical_high_findings": 0,
  "known_gaps": [
    {
      "id": "W00-LICENSE-001",
      "status": "open_non_blocking",
      "summary": "The immutable source has no license or SPDX metadata; no license was inferred."
    },
    {
      "id": "W00-BUILD-ENV-001",
      "status": "environment_blocked_non_blocking",
      "summary": "The offline host lacks build, setuptools, and wheel; standard backend and sdist verification are not claimed."
    },
    {
      "id": "W07-PLATFORM-SKIPS",
      "status": "platform_gated_non_blocking",
      "summary": "Four symlink/Windows/POSIX branch tests were skipped on the supported Windows host."
    },
    {
      "id": "W07-PRODUCTION-EFFECTS",
      "status": "disabled_by_design",
      "summary": "Production providers, credentials, publication, deployment, mutation, and migration activation remain disabled and unexercised."
    }
  ],
  "hard_blocker": null
}

